Nombre,Macro,Contact Reason 
[ACQ] - Registro: ¿Puedo utilizar mi tarjeta débito para retiros en el exterior?,"Sí, puedes hacer retiros en efectivo con tu tarjeta débito Nu en una gran cantidad de cajeros electrónicos de la red Mastercard a nivel nacional o internacional. Ten presente que el **límite para avances internacionales sería la equivalencia, en la moneda del país donde se haga el avance, de los $2.700.000,00 COP**, en un lapso de 24 horas. No obstante, es importante aclarar que la entidad bancaria extranjera en donde se haga el avance, puede manejar un límite diferente. Cada retiro en efectivo tiene un costo de **$6.800 pesos**. Además, es posible que Mastercard cobre una tasa de conversión del 0,45% sobre el valor del avance. Recuerda que los **cajeros automáticos nacionales o internacionales**, dependiendo de la entidad bancaria, podrían cobrar **tarifas adicionales** que no corresponden a las de Nu. Por otro lado, recuerda que tienes la posibilidad de realizar una transferencia a otra cuenta de ahorros de manera gratuita.",Inscripción y registro al mundo Nu (Prospectos nuevos)
[ACQ] - Registro:¿Qué diferencia tienen Bre-B y Redeban?,"En la siguiente tabla te contamos las diferencias principales: Transferencias con llaves de Redeban: Ya está disponible en Nu. Permite pagos rápidos entre bancos como Bancolombia, Nequi, y otros que usan Redeban. Para usarlo, debes registrar tus llaves (como tu celular, email, documento de identidad o Llave Nu) en el app de Nu, bajo la sección “Tus llaves”, y luego simplemente compartirlas con la persona que te hará el pago. Redeban y sus entidades gestionan este sistema. Bre-B: Planeado para comenzar en el segundo semestre de 2025, bajo la gestión del Banco de la República. Este sistema tiene como objetivo centralizar y unificar los pagos inmediatos en Colombia, involucrando a todos los bancos participantes. Las llaves para este sistema serán gestionadas por cada banco una vez que esté operativo. Similar al sistema de Redeban, funcionará mediante el uso de llaves compartidas para hacer transferencias. El Banco de la República se encargará de su administración. Si tenías registradas tus llaves en Redeban, debes confirmar tus llaves a Bre-B para que de esta forma puedas hacer tus transferencias inmediatas",Inscripción y registro al mundo Nu (Prospectos nuevos)
[ACQ] - Registro:¿Qué diferencia tienen Bre-B y Redeban?,"Hola, XXXXX. Gracias por contactar a Nu. Esperamos que te encuentres muy bien. “Bre-B”, desarrollado por el Banco de la República, permite que diferentes sistemas inmediatos como Redeban operen entre sí. En la siguiente tabla te contamos las diferencias principales: Transferencias con llaves de Redeban: Ya está disponible en Nu. Permite pagos rápidos entre bancos como Bancolombia, Nequi, y otros que usan Redeban. Para usarlo, debes registrar tus llaves (como tu celular, email, documento de identidad o Nu Placa) en el app de Nu, bajo la sección “Tus llaves”, y luego simplemente compartirlas con la persona que te hará el pago. Redeban y sus entidades gestionan este sistema. Bre-B: Planeado para comenzar en el segundo semestre de 2025, bajo la gestión del Banco de la República. Este sistema tiene como objetivo centralizar y unificar los pagos inmediatos en Colombia, involucrando a todos los bancos participantes. Las llaves para este sistema serán gestionadas por cada banco una vez que esté operativo. Similar al sistema de Redeban, funcionará mediante el uso de llaves compartidas para hacer transferencias. El Banco de la República se encargará de su administración. Si tenías registradas tus llaves en Redeban, debes confirmar tus llaves a Bre-B para que de esta forma puedas hacer tus transferencias inmediatas Para conocer más acerca de las llaves de identificación para pagos inmediatos, visita nuestro blog: https://blog.nu.com.co/llaves-de-identificacion-para-pagos-inmediatos/. Si tienes cualquier otra inquietud, no dudes en contactarnos nuevamente a través de nuestros canales oficiales de atención al cliente 24/7. Un abrazo, Equipo Nu. En Nu valoramos tu opinión y siempre buscamos mejorar nuestro servicio. En 24 horas, recibirás una encuesta en tu App donde podrás comentarnos, en una escala del 0 al 10, qué tanto recomendarías Nu, siendo: 1) 0 a 6: ""No nos recomendarías"" 2) 7 a 8: ""Quizá nos recomendarías"" 3) 9 a 10: ""Nos recomendarías totalmente"". ¡Te deseamos un gran día y recuerda que tenemos servicio 24/7 para apoyarte en lo que necesites!",Inscripción y registro al mundo Nu (Prospectos nuevos)
[ACQ] - Data policy: D+35: Me llego un mensaje de que perderé el acceso a mis productos Nu por no aceptar la Política ¿Por qué?,"Hola, {{ticket.requester.first_name}}, Gracias por contactar a Nu Colombia. Esperamos que estés muy bien. Para nosotros es muy importante contar con tu autorización, para seguir tratando tus datos personales conforme a nuestra nueva Política de Tratamiento de Datos Personales, es por ello, que es necesario que la revises y aceptes, para que puedas usar tus productos Nu sin problemas. Un abrazo, Equipo Nu.",Inscripción y registro al mundo Nu (Prospectos nuevos)
[ACQ] - Data policy: D+35: Me llego un mensaje de que perderé el acceso a mis productos Nu por no aceptar la Política ¿Por qué?,"Para nosotros es muy importante contar con tu autorización, para seguir tratando tus datos personales conforme a nuestra nueva Política de Tratamiento de Datos Personales, es por ello, que es necesario que la revises y aceptes, para que puedas usar tus productos Nu sin problemas.",Inscripción y registro al mundo Nu (Prospectos nuevos)
[ACQ] - Data policy: ¿Cuál es la diferencia entre la Política de datos del 2024 y del 2025?,"Queremos contarte que actualizamos nuestra Política de Tratamiento de Datos Personales para darte mayor claridad sobre cómo usamos tu información y reforzar nuestro compromiso con tu privacidad. ¿Qué cambia con esta nueva versión? 1️⃣Incluimos la finalidad para habilitar la funcionalidad de pagos inmediatos a través de sistemas de pagos inmediatos, incluyendo la incorporación, actualización y consulta de tu información en el Directorio Federado y el Directorio Centralizado, de acuerdo con la regulación aplicable. 2️⃣Explicamos mejor qué datos recolectamos y para qué los usamos, incluida la información que requerimos de los medios y canales a través de los cuales usas y accedes a los servicios ofrecidos por NU. 3️⃣Te contamos cómo protegemos tu información cuando usamos herramientas como inteligencia artificial. 4️⃣Reforzamos las medidas de seguridad y confidencialidad de tus datos, y la información que utilizamos de tus hábitos y dispositivos a través de los que accedes para prevención del fraude. 5️⃣Reiteramos tus derechos, ante quién y cómo puedes ejercerlos fácilmente a través nuestros canales de atención dispuestos para estos efectos.",Inscripción y registro al mundo Nu (Prospectos nuevos)
[ACQ] - Data policy: ¿Cuál es la diferencia entre la Política de datos del 2024 y del 2025?,"Hola, {{ticket.requester.first_name}}, Gracias por contactar a Nu Colombia. Esperamos que estés muy bien. Queremos contarte que actualizamos nuestra Política de Tratamiento de Datos Personales para darte mayor claridad sobre cómo usamos tu información y reforzar nuestro compromiso con tu privacidad. ¿Qué cambia con esta nueva versión? 1. Incluimos la finalidad para habilitar la funcionalidad de pagos inmediatos a través de sistemas de pagos inmediatos, incluyendo la incorporación, actualización y consulta de tu información en el Directorio Federado y el Directorio Centralizado, de acuerdo con la regulación aplicable. 2. Explicamos mejor qué datos recolectamos y para qué los usamos, incluida la información que requerimos de los medios y canales a través de los cuales usas y accedes a los servicios ofrecidos por NU. 3. Te contamos cómo protegemos tu información cuando usamos herramientas como inteligencia artificial. 4. Reforzamos las medidas de seguridad y confidencialidad de tus datos, y la información que utilizamos de tus hábitos y dispositivos a través de los que accedes para prevención del fraude. 5. Reiteramos tus derechos, ante quién y cómo puedes ejercerlos fácilmente a través nuestros canales de atención dispuestos para estos efectos. Un abrazo, Equipo Nu.",Inscripción y registro al mundo Nu (Prospectos nuevos)
[ACQ] - Data policy: ¿Cómo puedo aceptar la Política de Tratamiento de Datos 2025?,"¡Hola! {{ticket.requester.first_name}}, Gracias por contactar a Nu Colombia. Esperamos que estés muy bien. Puedes leer y aceptar nuestra nueva Política de Tratamiento de Datos, de las siguientes formas: Al ingresar a tu App Nu, te aparecerá un anuncio con la nueva Política de Tratamiento de Datos Personales, para que la revises y aceptes. Si este anuncio lo saltaste para más tarde, podrás acceder a revisar la política, mediante: El correo electrónico, lo puedes encontrar en tu bandeja de mensajes como: “Conoce y autoriza la nueva política de tratamiento de datos personales”; en el cuerpo del correo, encontrarás un botón que dice “Revisar y aceptar”. Notificación en la App Nu, la puede encontrar en el icono de usuario ‘👤’ que está en la parte superior izquierda de la aplicación; selecciona la opción de “Notificaciones” y luego busca el mensaje que diga “¡Tu privacidad importa!”. Ambas opciones te redireccionan al anuncio de la Política de Tratamiento de Datos Personales, para que la puedas leer y aceptar. Un abrazo, Equipo Nu.",Inscripción y registro al mundo Nu (Prospectos nuevos)
[ACQ] - Data policy: ¿Cómo puedo aceptar la Política de Tratamiento de Datos 2025?,"Puedes leer y aceptar nuestra nueva Política de Tratamiento de Datos, de las siguientes formas: 1. Al ingresar a tu App Nu, te aparecerá un anuncio con la nueva Política de Tratamiento de Datos Personales, para que la revises y aceptes. 2. Si este anuncio lo saltaste para más tarde, podrás acceder a revisar la política, mediante: - El correo electrónico, lo puedes encontrar en tu bandeja de mensajes como: “Conoce y autoriza la nueva política de tratamiento de datos personales”; en el cuerpo del correo, encontrarás un botón que dice “Revisar y aceptar”. - Notificación en la App Nu, la puede encontrar en el icono de usuario ‘👤’ que está en la parte superior izquierda de la aplicación; selecciona la opción de “Notificaciones” y luego busca el mensaje que diga “¡Tu privacidad importa!”. Ambas opciones te redireccionan al anuncio de la Política de Tratamiento de Datos Personales, para que la puedas leer y aceptar.",Inscripción y registro al mundo Nu (Prospectos nuevos)
[ACQ] - Data policy: ¿Por qué debo aceptar esta nueva Política de Tratamiento de Datos?,"Tú tienes el control de la información que compartes con nosotros, y aceptarla es clave para seguir usando tus productos Nu sin preocupaciones. Nuestra Política de Tratamiento de Datos Personales te explica que datos recopilamos, como la usamos y como la mantenemos segura en Nu.",Inscripción y registro al mundo Nu (Prospectos nuevos)
[ACQ] - Data policy: ¿Por qué debo aceptar esta nueva Política de Tratamiento de Datos?,"Hola, {{ticket.requester.first_name}}, Gracias por contactar a Nu Colombia. Esperamos que estés muy bien. Tú tienes el control de la información que compartes con nosotros, y aceptarla es clave para seguir usando tus productos Nu sin preocupaciones. Nuestra Política de Tratamiento de Datos Personales te explica que datos recopilamos, como la usamos y cómo la mantenemos segura en Nu. Un abrazo, Equipo Nu.",Inscripción y registro al mundo Nu (Prospectos nuevos)
[ACQ] - Data policy: ¿Qué pasa si no acepto o doy mi consentimiento para esta nueva política? / ¿Por qué no puede ser opcional el aceptar la Política de Tratamiento de Datos?,"Hola, {{ticket.requester.first_name}}, Gracias por contactar a Nu Colombia. Esperamos que estés muy bien. Respetamos tu decisión, pero sin tu autorización no podríamos brindarte la experiencia Nu que mereces. El tratamiento de tus datos es necesario para validar tu identidad, cumplir con nuestras obligaciones legales, comunicarnos contigo y habilitar funcionalidades clave que hacen más fácil y segura tu experiencia con Nu. Si tienes dudas o prefieres contarnos por qué no deseas aceptarla, estamos aquí para escucharte. Un abrazo, Equipo Nu.",Inscripción y registro al mundo Nu (Prospectos nuevos)
[ACQ] - Data policy: ¿Qué pasa si no acepto o doy mi consentimiento para esta nueva política? / ¿Por qué no puede ser opcional el aceptar la Política de Tratamiento de Datos?,"Respetamos tu decisión, pero sin tu autorización no podríamos brindarte la experiencia Nu que mereces. El tratamiento de tus datos es necesario para validar tu identidad, cumplir con nuestras obligaciones legales, comunicarnos contigo y habilitar funcionalidades clave que hacen más fácil y segura tu experiencia con Nu. Si tienes dudas o prefieres contarnos por qué no deseas aceptarla, estamos aquí para escucharte.",Inscripción y registro al mundo Nu (Prospectos nuevos)
[ACQ] - Prospecto abandoned o confirmed: No sé en qué pantalla está la persona (pregunta abierta),"Para mí será todo un gusto ayudarte 💜, para poder entender mejor tu consulta. Me puedes describir/contar en que paso del registro estas.",Inscripción y registro al mundo Nu (Prospectos nuevos)
[ACQ] - Prospecto abandoned o confirmed: ," No sé en qué pantalla está la persona (pregunta cerrada)Para mí, es muy importante ayudarte en esta fase de registro 💜, me puedes confirmar si la pantalla que estás viendo en estos momentos es (modifica esta macro según la pantalla que consideres que está viendo el/la prospecto)",Inscripción y registro al mundo Nu (Prospectos nuevos)
[ACQ] - Prospectos que pueden acceder al home screen.,"Gracias por contarnos lo sucedido. Queremos informarte que tu proceso de registro está en la etapa de validación. Esto es parte de nuestro procedimiento estándar para asegurarnos de ofrecerte el mejor servicio posible.Es por eso que, por el momento, no puedes ver ni activar tus productos. Sabemos que estás con ganas de usar Nu, y te agradecemos mucho por tu paciencia. Tan pronto finalicemos la revisión te avisaremos si ya puedes acceder al app y comenzar a disfrutar de todos los beneficios que tenemos para ti.",Inscripción y registro al mundo Nu (Prospectos nuevos)
"[ACQ] - Registro: Después de poner la dirección, ¿puedo actualizarla?","Si puedes actualizar tus datos, también puedes indicarnos una dirección de entrega diferente a la de residencia si lo prefieres. Solo ten en cuenta que la dirección donde se entregue la tarjeta debe contar con nomenclatura visible en la fachada y un adulto que pueda recibir.",Inscripción y registro al mundo Nu (Prospectos nuevos)
"[ACQ] - Registro: Hago clic en el link de confirmación y no funciona, ¿qué hago?","Puedes intentar el proceso desde un computador, al darle clic al link vas a ser redirigido a nuestra página web, donde vas a ingresar tu número de documento y tu correo registrado, luego hacer la confirmación, debes dirigirte a la App y seleccionar la opción “Ya confirme mi correo”. En caso de que no cuentes con un computador, intenta copiando y pegando el link en el navegador que tengas instalado. Si esta acción no funciona, déjanos saber para realizar el reporte correspondiente con nuestro equipo encargado.",Inscripción y registro al mundo Nu (Prospectos nuevos)
"[ACQ] - Registro: Las fotos me están saliendo borrosas, ¿qué puedo hacer?","Para la situación que presentas, te recomiendo buscar un lugar iluminado, pero que no afecte la visibilidad de los documentos. También, puedes colocar tu documento de identidad sobre una mesa o un sitio donde puedas apoyar tus brazos y así tener mucha más estabilidad al tomar las fotos.",Inscripción y registro al mundo Nu (Prospectos nuevos)
"[ACQ] - Registro: No me llega el correo de confirmación, ¿qué hago?","No te preocupes, puede ser que quizás lo recibiste en la bandeja de Spam/correos no deseados, por lo que te recomiendo revisar nuevamente. Si no lo encuentras en dicha bandeja, puede ser que tuviste algún error de digitación en tu correo electrónico mientras estabas haciendo el proceso de registro y no hay de qué preocuparse, tienes la opción de modificar el correo electrónico al cual te vamos a enviar el mensaje de confirmación. Para hacerlo solo sigue estos sencillos pasos: 1. Da clic en la opción “No recibí el correo”. 2. Si el correo tiene un error de digitación, selecciona “Este no es mi correo”. 3. Finalmente, digita el correo correcto y luego da clic en “Reenviar correo”. 4. Revisa tu correo electrónico y realiza el proceso de confirmación. Y ¡listo! Habrás terminado tu registro en el App exitosamente. Nuestro equipo revisará que toda la información se encuentre correcta para poder ofrecerte el mejor servicio.",Inscripción y registro al mundo Nu (Prospectos nuevos)
"[ACQ] - Registro: No me llega el código de verificación, ¿qué hago?","No te preocupes, aquí te comparto algunas recomendaciones que pueden ayudarte: 1. Verifica que ingresaste el número de teléfono correcto (10 dígitos) y que no haya errores en la digitación. 2. Es importante que tu número de teléfono sea colombiano (indicativo +57 🇨🇴) y que no sea de un tercero. 3. Asegúrate de tener buena señal en tu teléfono. Si la señal es baja o inestable, intenta cambiar de ubicación y revisa que el modo avión esté desactivado. 4. Confirma que puedes recibir mensajes de texto y que no tienes bloqueadas las notificaciones de tu operador. El mensaje SMS puede tarde entre 45 a 60 segundos en llegar dependiendo del operador telefónico que tengas, si luego este tiempo no recibes el mensaje de texto, puedes dar clic en “enviar un nuevo código”, para recibir uno nuevo. En caso de que el mensaje siga sin llegar después de varios minutos, o presentes algún inconveniente, no dudes en reportarnos lo sucedido para ayudarte lo más pronto posible.",Inscripción y registro al mundo Nu (Prospectos nuevos)
"[ACQ] - Registro: No me llega el código de verificación, ¿qué hago?","Hola, XXXXX: Gracias por contarme lo sucedido, en esta ocasión te recomiendo: No te preocupes, aquí te comparto algunas recomendaciones que pueden ayudarte: 1. Verifica que ingresaste el número de teléfono correcto (10 dígitos) y que no haya errores en la digitación. 2. Es importante que tu número de teléfono sea colombiano (indicativo +57 :flag-co:) y que no sea de un tercero. 3. Asegúrate de tener buena señal en tu teléfono. Si la señal es baja o inestable, intenta cambiar de ubicación y revisa que el modo avión esté desactivado. 4. Confirma que puedes recibir mensajes de texto y que no tienes bloqueadas las notificaciones de tu operador. En caso de que el mensaje SMS siga sin llegar, no te preocupes, también tienes la opción de hacer el proceso de verificación de tu número de teléfono cuando ya seas cliente Nu, solo debes dar clic en el botón de ""Después"". Si quieres realizar el proceso ahora y sigues presentando el inconveniente del mensajes, no dudes en contactarnos nuevamente para poder ayudarte con el proceso y reportarlo con nuestro equipo encargado Si tienes cualquier otra inquietud, no dudes en contactarnos nuevamente a través de nuestros canales oficiales de atención al cliente 24/7. Un abrazo, Equipo Nu.",Inscripción y registro al mundo Nu (Prospectos nuevos)
[ACQ] - Registro: No sé si soy un PEP,"Si tú o un familiar cercano (como padres, abuelos, hermanos, cónyuge o hijos) ocupa o ha ocupado un cargo importante en el gobierno o el sector público, podrías ser considerado PEP. Esta condición se mantiene hasta 2 años después de dejar el cargo. Si aún tienes dudas, consulta el Decreto 830 de 2021 o verifica si existe una Declaración PEP a tu nombre o de un familiar cercano en la página del SIGEP.",Inscripción y registro al mundo Nu (Prospectos nuevos)
[ACQ] - Registro: Pasos para elegir las llaves,"Las llaves son datos que registras para identificar tu Cuenta Nu dentro del Servicio de transferencias inmediatas para que puedas enviar y recibir dinero al instante. Con este servicio, se pueden hacer transferencias de hasta $8.000.000 de manera inmediata entre bancos, entidades financieras y billeteras digitales que participan en el sistema de Redeban. Solo debes registrar tus llaves, es decir, los datos que registras para identificar tu Cuenta Nu para procesar las transferencias. Para elegir tus llaves, en el registro, solo debes seguir estos sencillos pasos: 1. Selecciona las llaves que deseas registrar, puede ser tu celular, correo electrónico, cédula y/o tu llave Nu (Código alfanumérico, en el caso de Nu es @ y tu Nu Placa). 2. Lee los términos y condiciones del sistema de pagos inmediatos; si estás de acuerdo, acéptalos, dando clic en “Continuar”. 3. Las llaves seleccionadas quedarán registradas cuando tu cuenta Nu esté lista, es decir, luego de que revisemos tus datos.",Inscripción y registro al mundo Nu (Prospectos nuevos)
[ACQ] - Registro: Pasos para elegir las llaves,"Hola, XXXXX. Gracias por contactar a Nu. Esperamos que te encuentres muy bien. Las llaves son datos que registras para identificar tu Cuenta Nu dentro del Servicio de transferencias inmediatas para que puedas enviar y recibir dinero al instante. Con este servicio, se pueden hacer transferencias de hasta $8.000.000 de manera inmediata entre bancos, entidades financieras y billeteras digitales que participan en el sistema de Redeban. Solo debes registrar tus llaves, es decir, los datos que registras para identificar tu Cuenta Nu para procesar las transferencias. Para elegir tus llaves, en el registro, solo debes seguir estos sencillos pasos: 1. Selecciona las llaves que deseas registrar, puede ser tu celular, correo electrónico, cédula y/o tu llave Nu (Código alfanumérico, en el caso de Nu es @ y tu Nu Placa). 2. Lee los términos y condiciones del sistema de pagos inmediatos; si estás de acuerdo, acéptalos, dando clic en “Continuar”. 3. Las llaves seleccionadas quedarán registradas cuando tu cuenta Nu esté lista, es decir, luego de que revisemos tus datos. Para conocer más acerca de las llaves de identificación para pagos inmediatos, visita nuestro blog: https://blog.nu.com.co/llaves-de-identificacion-para-pagos-inmediatos/. Si tienes cualquier otra inquietud, no dudes en contactarnos nuevamente a través de nuestros canales oficiales de atención al cliente 24/7. Un abrazo, Equipo Nu. En Nu valoramos tu opinión y siempre buscamos mejorar nuestro servicio. En 24 horas, recibirás una encuesta en tu App donde podrás comentarnos, en una escala del 0 al 10, qué tanto recomendarías Nu, siendo: 1) 0 a 6: ""No nos recomendarías"" 2) 7 a 8: ""Quizá nos recomendarías"" 3) 9 a 10: ""Nos recomendarías totalmente"". ¡Te deseamos un gran día y recuerda que tenemos servicio 24/7 para apoyarte en lo que necesites!",Inscripción y registro al mundo Nu (Prospectos nuevos)
[ACQ] - Registro: Pasos para registrar las llaves,"Hola, XXXXX. Gracias por contactar a Nu. Esperamos que te encuentres muy bien. Las llaves son datos que registras y usas dentro del Servicio de transferencias inmediatas del Banco de la República para enviar y recibir dinero al instante entre bancos. Puede ser tu número de celular, correo electrónico, documento de identidad, y una Llave Alfanumérica como tu Llave Nu. Tú eliges las llaves que desees registrar y compartir para recibir dinero en segundos. Para elegir tus llaves, en el registro, solo debes seguir estos sencillos pasos: 1. Selecciona las llaves que deseas registrar, puede ser tu celular, correo electrónico, cédula y/o tu llave Nu (Código alfanumérico, en el caso de Nu es @ y tu Nu Placa). 2. Lee los términos y condiciones del sistema de pagos inmediatos; si estás de acuerdo, acéptalos, dando clic en “Continuar”. 3. Las llaves seleccionadas quedarán registradas cuando tu cuenta Nu esté lista, es decir, luego de que revisemos tus datos. Para conocer más acerca de las llaves de identificación para pagos inmediatos, visita nuestro blog: https://blog.nu.com.co/llaves-de-identificacion-para-pagos-inmediatos/. Si tienes cualquier otra inquietud, no dudes en contactarnos nuevamente a través de nuestros canales oficiales de atención al cliente 24/7. Un abrazo, Equipo Nu. En Nu valoramos tu opinión y siempre buscamos mejorar nuestro servicio. En 24 horas, recibirás una encuesta en tu App donde podrás comentarnos, en una escala del 0 al 10, qué tanto recomendarías Nu, siendo: 1) 0 a 6: ""No nos recomendarías"" 2) 7 a 8: ""Quizá nos recomendarías"" 3) 9 a 10: ""Nos recomendarías totalmente"". ¡Te deseamos un gran día y recuerda que tenemos servicio 24/7 para apoyarte en lo que necesites!",Inscripción y registro al mundo Nu (Prospectos nuevos)
