Nombre,Macro,Contact Reason 
[ACQ] - Solo veo un botón en la App ¿Cómo hago el proceso para registrarme a Nu?,"¡Hola {{ticket.requester.first_name}}! Gracias por contactar a Nu Colombia, esperamos que te encuentres muy bien. ¡Nos encanta que quieras unirte a Nu! Registrarte es muy sencillo: 1. Descarga la App: Busca ""Nu"" en la Play Store (Android) o App Store (iOS) y descárgala. 2. Inicia tu registro: Abre la app y toca ""Comenzar"" en la pantalla principal. Te guiaremos paso a paso. 3. ¿Empezaste en la web? ¡No hay problema! La app reconocerá tus datos si ya iniciaste el registro en nuestra página web, y podrás continuar justo donde lo dejaste. Si tienes cualquier otra inquietud, no dudes en contactarnos nuevamente a través de nuestros canales oficiales de atención al cliente 24/7 y estaremos felices de ayudarte. Un abrazo, Equipo Nu",Inscripción y registro al mundo Nu (Prospectos nuevos)
"[ACQ] - Whatsapp: He ingresado mi nombre y no me deja continuar con el registro ¿Qué puedo hacer? (error en nombre/apellido, aplicación archivada)","Hemos detectado que, después de varios intentos, el nombre o apellido ingresado no ha sido reconocido por nuestro sistema. Puede que esto se deba a un error de digitación o a un nombre poco común. Para continuar con tu registro y garantizar que tus datos sean correctos, te invitamos a finalizar el proceso en nuestra página web de Nu Colombia. Por favor, visita el siguiente enlace para completar tu registro: https://www.nu.com.co/ Si encuentras algún problema adicional, no dudes en contactarnos. Estamos aquí para ayudarte.",Inscripción y registro al mundo Nu (Prospectos nuevos)
"[ACQ] - Whatsapp: He ingresado mi nombre y no me deja continuar con el registro ¿Qué puedo hacer? (error en nombre/apellido, aplicación archivada) (Email)","¡Hola! {{ticket.requester.first_name}}, Gracias por ponerte en contacto con nosotros. Hemos detectado que, después de varios intentos, el nombre o apellido ingresado no ha sido reconocido por nuestro sistema. Puede que esto se deba a un error de digitación o a un nombre poco común. Para continuar con tu registro y garantizar que tus datos sean correctos, te invitamos a finalizar el proceso en nuestra página web de Nu Colombia. Por favor, visita el siguiente enlace para completar tu registro: https://www.nu.com.co/ Si encuentras algún problema adicional, no dudes en contactarnos. Estamos aquí para ayudarte. ¡Gracias por elegir Nu! Un abrazo, Equipo Nu.",Inscripción y registro al mundo Nu (Prospectos nuevos)
[ACQ] - Whatsapp: Estoy escribiendo por Whatsapp pero solo me responde un robot.Entendemos que estás intentando comunicarte con nosotros a través de WhatsApp. ,"Te contamos que por el momento este canal está diseñado específicamente para ayudarte con tu proceso de registro y es operado por nuestro sistema automatizado. Para cualquier otra consulta o asistencia, te invitamos a que nos contactes a través de los siguientes medios de servicio al cliente: Teléfono: Colombia: 01 800 917 2000 Bogotá: (+57) 601 357 1102 Resto del mundo: (+1) 636 722 7111 Correo electrónico: ayuda@nu.com.co Nuestros agentes estarán encantados de asistirte con cualquier inquietud.",Inscripción y registro al mundo Nu (Prospectos nuevos)
[ACQ] - Whatsapp: Estoy escribiendo por Whatsapp pero solo me responde un robot.,"Hola {{ticket.requester.first_name}} Esperamos que te encuentres muy bien el día de hoy. Entendemos que estás intentando comunicarte con nosotros a través de WhatsApp. Te contamos que por el momento este canal está diseñado específicamente para ayudarte con tu proceso de registro y es operado por nuestro sistema automatizado. Para cualquier otra consulta o asistencia, te invitamos a que nos contactes a través de los siguientes medios de servicio al cliente: Teléfono: Colombia: 01 800 917 2000 Bogotá: (+57) 601 357 1102 Resto del mundo: (+1) 636 722 7111 Correo electrónico: ayuda@nu.com.co Nuestros agentes estarán encantados de asistirte con cualquier inquietud. Gracias por tu comprensión y por elegir Nu. ¡Estamos para ayudarte! Un abrazo, Equipo Nu.",Inscripción y registro al mundo Nu (Prospectos nuevos)
[ACQ] - Whatsapp: No me funciona Whatsapp de NU. ¿Qué puedo hacer? (Error en wp)Gracias por avisarnos sobre esta situación. ,"Actualmente estamos experimentando algunos problemas técnicos con el proceso de inscripción desde la App de WhatsApp, los cuales podrían estar afectando tu proceso de registro. Pero no tienes de qué preocuparte. Para seguir con tu registro, te invitamos a utilizar una de estas opciones alternativas: Visita nuestra página web y completa tu registro allí: www.nu.com.co Descarga nuestra app de Nu en tu dispositivo móvil desde Google Play Store o App Store. Estas opciones te permitirán continuar con tu registro de manera rápida y segura. ¡Estamos para ayudarte!",Inscripción y registro al mundo Nu (Prospectos nuevos)
[ACQ] - Whatsapp: No me funciona Whatsapp de NU. ¿Qué puedo hacer? (Error en wp),"Hola {{ticket.requester.first_name}} Gracias por avisarnos sobre esta situación. Actualmente estamos experimentando algunos problemas técnicos con el proceso de inscripción desde la App de WhatsApp, los cuales podrían estar afectando tu proceso de registro. Pero no tienes de qué preocuparte. Para seguir con tu registro, te invitamos a utilizar una de estas opciones alternativas: Visita nuestra página web y completa tu registro allí: www.nu.com.co Descarga nuestra app de Nu en tu dispositivo móvil desde Google Play Store o App Store. Estas opciones te permitirán continuar con tu registro de manera rápida y segura. Si necesitas más ayuda o tienes alguna pregunta, por favor no dudes en contactarnos. ¡Gracias por tu paciencia y comprensión! Un abrazo, Equipo Nu.",Inscripción y registro al mundo Nu (Prospectos nuevos)
[ACQ] - Whatsapp: ¿Cómo puedo hacer el registro por Whatsapp?,"Nos alegra mucho que estés interesado en unirte a Nu. ¡Estamos aquí para ayudarte con el registro por WhatsApp! Es muy sencillo: Visita nuestra página web oficial. Haz clic en ""aplicar por WhatsApp"" y te dirigirá al número oficial donde podrás registrarte. Si lo prefieres, también puedes escribirnos directamente al tel:+5715142304 desde tu app de WhatsApp para realizar el registro de manera segura. Estamos muy emocionados de tenerte pronto con nosotros y liberarte de la complejidad financiera.",Inscripción y registro al mundo Nu (Prospectos nuevos)
[ACQ] - Whatsapp: ¿Cómo puedo hacer el registro por Whatsapp?,"Hola {{ticket.requester.first_name}} Esperamos que te encuentres muy bien el día de hoy. Nos alegra mucho que estés interesado en unirte a Nu. ¡Estamos aquí para ayudarte con el registro por WhatsApp! Es muy sencillo: Visita nuestra página web oficial. Haz clic en ""aplicar por WhatsApp"" y te dirigirá al número oficial donde podrás registrarte. Si lo prefieres, también puedes escribirnos directamente al número:+5715142304 desde tu app de WhatsApp para realizar el registro de manera segura. Estamos muy emocionados de tenerte pronto con nosotros y liberarte de la complejidad financiera. Un abrazo, Equipo Nu.",Inscripción y registro al mundo Nu (Prospectos nuevos)
[ACQ] - Whatsapp: ¿Cómo puedo retomar el registro en Whatsapp?,"Estamos emocionados de que estés interesado en unirte al mundo de NU. Si estás llevando a cabo el proceso de registro a través de la aplicación de WhatsApp y necesitas retomarlo tras una interrupción, puedes hacerlo fácilmente escribiendo una de las siguientes frases: Opción 1: ¡Hola, quiero aplicar a Nu! Opción 2: ¡Hola, hoy quiero aplicar a Nu! Asegúrate de que el número de WhatsApp al que estás escribiendo sea el número oficial verificado de Nu Colombia, identificado con el icono azul. Esperamos que pronto te unas a esta gran familia.",Inscripción y registro al mundo Nu (Prospectos nuevos)
[ACQ] - Whatsapp: ¿Cómo puedo retomar el registro en Whatsapp?,"Hola {{ticket.requester.first_name}} Esperamos que te encuentres muy bien el día de hoy. Estamos emocionados de que estés interesado en unirte al mundo de NU. Si estás llevando a cabo el proceso de registro a través de la aplicación de WhatsApp y necesitas retomarlo tras una interrupción, puedes hacerlo fácilmente escribiendo una de las siguientes frases: Opción 1: ¡Hola, quiero aplicar a Nu! Opción 2: ¡Hola, hoy quiero aplicar a Nu! Asegúrate de que el número de WhatsApp al que estás escribiendo sea el número oficial verificado de Nu Colombia, identificado con el icono azul. Esperamos que pronto te unas a esta gran familia. Un abrazo, Equipo Nu.",Inscripción y registro al mundo Nu (Prospectos nuevos)
[ACQ] - Whatsapp: ¿Es seguro hacer el registro desde Whatsapp?,"¡Hola! {{ticket.requester.first_name}}, te hablamos de Nu, Gracias por ponerte en contacto con nosotros. ¡Te contamos que es completamente seguro! Puedes validar que el número de WhatsApp que utilizamos está verificado. puedes confirmarlo al ver el icono de la marca azul. Además, puedes completar el formulario o registro sin ningún inconveniente a través de esta plataforma. Sin embargo, si lo prefieres, también tienes la opción de aplicar a través de nuestra página web www.nu.com.co o descargando nuestra app de Nu en tu dispositivo móvil desde Google Play Store o App Store. Ten presente que los datos solicitados desde la app de Whatsapp, son solo para el proceso de registro a NU. Estamos aquí para brindarte la máxima comodidad y seguridad en tu experiencia. Si necesitas más ayuda, no dudes en contactarnos. Recuerda que estamos a tu disposición 24/7 en caso de que tengas cualquier duda. Un abrazo, Equipo Nu.",Inscripción y registro al mundo Nu (Prospectos nuevos)
[ACQ] - Whatsapp: ¿Es seguro hacer el registro desde Whatsapp?,"¡Claro que sí, es completamente seguro! Puedes validar que el número de WhatsApp que utilizamos está verificado. puedes confirmarlo al ver el icono de la marca azul. Además, puedes completar el formulario o registro sin ningún inconveniente a través de esta plataforma. Sin embargo, si lo prefieres, también tienes la opción de aplicar a través de nuestra página web www.nu.com.co o descargando nuestra app de Nu en tu dispositivo móvil desde Google Play Store o App Store. Ten presente que los datos solicitados desde la app de Whatsapp, son solo para el proceso de registro a NU. Estamos aquí para brindarte la máxima comodidad y seguridad en tu experiencia.",Inscripción y registro al mundo Nu (Prospectos nuevos)
[ACQ] - Whatsapp: ¿Por que me aparece error cuando ingreso el numero de telefono? (Número que no es de Colombia),"Veo que estás teniendo problemas al ingresar tu número de teléfono. Esto podría estar ocurriendo porque el número ingresado no es un número de teléfono colombiano. Para corregir este error, por favor asegúrate de que el número de teléfono: Comience con el código de país de Colombia: +57. Tenga un total de 10 dígitos después del código de país, en el formato correcto. Ejemplo: +573001234567. Si tu número sigue este formato y aún tienes problemas, asegúrate de eliminar cualquier espacio, guión o carácter especial. ¡Recuerda que estamos para ayudarte!",Inscripción y registro al mundo Nu (Prospectos nuevos)
[ACQ] - Whatsapp: ¿Por que me aparece error cuando ingreso el numero de telefono? (Número que no es de Colombia),"¡Hola! {{ticket.requester.first_name}}, Veo que estás teniendo problemas al ingresar tu número de teléfono. Esto podría estar ocurriendo porque el número ingresado no es un número de teléfono colombiano. Para corregir este error, por favor asegúrate de que el número de teléfono: Comience con el código de país de Colombia: +57. Tenga un total de 10 dígitos después del código de país, en el formato correcto. Ejemplo: +573001234567. Si tu número sigue este formato y aún tienes problemas, asegúrate de eliminar cualquier espacio, guión o carácter especial. Si necesitas más ayuda, no dudes en contactarnos. Recuerda que estamos a tu disposición 24/7 en caso de que tengas cualquier duda. Un abrazo, Equipo Nu.",Inscripción y registro al mundo Nu (Prospectos nuevos)
[ACQ] - ¿Cuál es la diferencia entre transferencias inmediatas e interbancarias con ACH?,"Te contamos cuáles son las principales diferencias: Transferencias Inmediatas: →Se realizan en tiempo real, con llegada casi instantánea del dinero. →Disponibles 24/7. →Útiles para pagos urgentes. →Pueden tener costos más altos. Transferencias Interbancarias con ACH: →Tardan de 1 a varios días en completarse. →Procesadas en lotes a través de cámaras de compensación. →Más económicas, ideales para pagos recurrentes. →Adecuadas para transacciones no urgentes.",Inscripción y registro al mundo Nu (Prospectos nuevos)
[ACQ] - ¿Cuál es la diferencia entre transferencias inmediatas e interbancarias con ACH?,"Hola, XXXXX. Gracias por contactar a Nu. Esperamos que te encuentres muy bien. Te contamos cuáles son las principales diferencias: Transferencias Inmediatas: →Se realizan en tiempo real, con llegada casi instantánea del dinero. →Disponibles 24/7. →Útiles para pagos urgentes. →Pueden tener costos más altos. Transferencias Interbancarias con ACH: →Tardan de 1 a varios días en completarse. →Procesadas en lotes a través de cámaras de compensación. →Más económicas, ideales para pagos recurrentes. →Adecuadas para transacciones no urgentes. Para conocer más acerca de las llaves de identificación para pagos inmediatos, visita nuestro blog: https://blog.nu.com.co/llaves-de-identificacion-para-pagos-inmediatos/. Si tienes cualquier otra inquietud, no dudes en contactarnos nuevamente a través de nuestros canales oficiales de atención al cliente 24/7. Un abrazo, Equipo Nu. En Nu valoramos tu opinión y siempre buscamos mejorar nuestro servicio. En 24 horas, recibirás una encuesta en tu App donde podrás comentarnos, en una escala del 0 al 10, qué tanto recomendarías Nu, siendo: 1) 0 a 6: ""No nos recomendarías"" 2) 7 a 8: ""Quizá nos recomendarías"" 3) 9 a 10: ""Nos recomendarías totalmente"". ¡Te deseamos un gran día y recuerda que tenemos servicio 24/7 para apoyarte en lo que necesites!",Inscripción y registro al mundo Nu (Prospectos nuevos)
[ACQ] - ¿Cómo puedo continuar el proceso de registro en la app?," ProspectoNos alegra que quieras hacer parte del mundo Nu. Para seguir con tu proceso de registro en la app, tienes dos opciones: Si ya comenzaste el registro en la página web: solo descarga la app Nu, haz clic en el botón ""Comenzar"" y confirma tus datos, como tipo y número de documento. Desde ahí podrás continuar con el proceso de registro donde lo dejaste. Si aún no has comenzado el registro: ¡No hay problema! Puedes iniciar el proceso desde la app. Descárgala, haz clic en ""Comenzar"" y sigue los pasos para completar tu registro desde cero. ¡Estamos aquí para ayudarte en cada paso! Si tienes preguntas, no dudes en contactarnos.",Inscripción y registro al mundo Nu (Prospectos nuevos)
[ACQ] - ¿Cómo puedo continuar el proceso de registro en la app? Prospecto,"Hola {{ticket.requester.first_name}}! Gracias por contactar a Nu Colombia, esperamos que te encuentres muy bien. Nos alegra que quieras hacer parte del mundo Nu. Para seguir con tu proceso de registro en la app, tienes dos opciones: Si ya comenzaste el registro en la página web: solo descarga la app Nu, haz clic en el botón ""Comenzar"" y confirma tus datos, como tipo y número de documento. Desde ahí podrás continuar con el proceso de registro donde lo dejaste. Si aún no has comenzado el registro: ¡No hay problema! Puedes iniciar el proceso desde la app. Descárgala, haz clic en ""Comenzar"" y sigue los pasos para completar tu registro desde cero. Si tienes cualquier otra inquietud, no dudes en contactarnos nuevamente a través de nuestros canales oficiales de atención al cliente 24/7 y estaremos felices de ayudarte. Un abrazo, Equipo Nu",Inscripción y registro al mundo Nu (Prospectos nuevos)
[ACQ] - ¿Por qué ahora solo aparece un botón en la App? (Usuario),"¡Hola {{ticket.requester.first_name}}! Gracias por contactar a Nu Colombia, esperamos que te encuentres muy bien. Entendemos tu inquietud sobre la nueva forma de ingresar a la app Nu. ¡No te preocupes! Hicimos este cambio para que tu experiencia sea más simple y rápida. Esta actualización está diseñada para identificar tu perfil y redirigirte automáticamente a la pantalla correcta dentro de la app. El botón ""Comenzar"" ahora es más inteligente: -Si te estás registrando, te guiará en el proceso; -Si ya eres cliente, te llevará directo al inicio de sesión. De esta manera, la app Nu identifica tu perfil y te dirige a la pantalla correcta. Si tienes cualquier otra inquietud, no dudes en contactarnos nuevamente a través de nuestros canales oficiales de atención al cliente 24/7 y estaremos felices de ayudarte. Un abrazo, Equipo Nu",Inscripción y registro al mundo Nu (Prospectos nuevos)
[ACQ] - ¿Por qué ahora solo aparece un botón en la App? (Usuario),"¡Hola! Entendemos tu inquietud sobre la nueva forma de ingresar a la app Nu. ¡No te preocupes! Hicimos este cambio para que tu experiencia sea más simple y rápida. Esta actualización está diseñada para identificar tu perfil y redirigirte automáticamente a la pantalla correcta dentro de la app. El botón ""Comenzar"" ahora es más inteligente: - Si te estás registrando, te guiará en el proceso; - Si ya eres cliente, te llevará directo al inicio de sesión. De esta manera, la app Nu identifica tu perfil y te dirige a la pantalla correcta. Día a día estamos mejorando para ti. Si tienes dudas, contáctanos. ¡Estamos aquí para ayudarte!",Inscripción y registro al mundo Nu (Prospectos nuevos)
[ACQ] Push - Para que me envían mensajes si me han rechazado la solicitud antes¡,"Gracias por tu interés en nuestra comunidad Nu! Nuestro sistema siempre está aprendiendo y mejorando, por eso te invitamos a que apliques nuevamente para que te podamos evaluar una vez más y ofrecerte los productos que mejor se adapten a ti.",Inscripción y registro al mundo Nu (Prospectos nuevos)
"[ACQ] Push - Quiero que den de baja mis datosLamentamos verte ir, pero respetamos totalmente tu decisión."," Nos gustaría informarte que esta comunicación que recibiste, proviene de tu operador, por lo que vamos a escalar tu solicitud con Claro para que sea tomada en cuenta y no recibas mensajes en futuras comunicaciones relacionadas con NU. Recuerda que si quieres conocer de Nu puedes realizar tu registro a través de nuestra página web https://nu.com.co/",Inscripción y registro al mundo Nu (Prospectos nuevos)
"[ACQ] Push - Ustedes ya me habían dicho que no me la aprobaron, ¿por qué ahora sí?","Nuestro sistema siempre está aprendiendo y mejorando, por eso te invitamos a que apliques nuevamente para que te podamos evaluar una vez más y ofrecerte los productos que mejor se adapten a ti.",Inscripción y registro al mundo Nu (Prospectos nuevos)
"[ACQ] Push - Ya soy cliente, ¿porque me llegan estos mensajes?","¡Qué gusto saber que ya eres parte de nuestra comunidad! Estamos muy emocionados por dar a conocer el mundo Nu a más personas y, en esta ocasión, estamos colaborando con tu proveedor de telefonía móvil para compartir nuestra visión. Te invitamos a que compartas el efecto morado y que tus personas favoritas puedan liberarse también de la complejidad financiera.",Inscripción y registro al mundo Nu (Prospectos nuevos)
[ACQ] Push - ¿Cómo consiguieron mis datos?,"Gracias por contactarte con Nu. Queremos contarte que Nu no está realizando el tratamiento de tus datos personales, y el motivo por el que recibiste este mensaje es porque autorizaste de manera previa a tu operador para esta finalidad.",Inscripción y registro al mundo Nu (Prospectos nuevos)
[ACQ] Push - ¿Cómo sé que es Nu quien me ha enviado el mensaje?,"Gracias por contactarte con Nu. Entendemos lo importante que es para ti asegurarte de la autenticidad de las comunicaciones que recibes. El mensaje de texto que recibiste es un mensaje publicitario, de Nu, para invitarte a aplicar al mudo Nu y, enviado en alianza con tu operador. ¡Esperamos que te unas a nuestra comunidad pronto! Si tienes más dudas, no dudes en contarnos, para ayudarte en lo que necesites.",Inscripción y registro al mundo Nu (Prospectos nuevos)
[ACQ] Push - ¿Es solo publicidad?,Es una invitación a aplicar a Nu y ser parte del futuro de las finanzas. Creemos que tenemos productos que pueden ayudarte a recuperar el control de tu dinero y liberarte de la complejidad y burocracia. ¡Esperamos que te unas a nuestra comunidad pronto!,Inscripción y registro al mundo Nu (Prospectos nuevos)
[ACQ] Push - ¿Me han aprobado la tarjeta?,"¡Gracias por tu interés en nuestra tarjeta Nu! En esta oportunidad recibiste un mensaje donde te invitamos a aplicar a Nu y al hacerlo te ofreceremos la opción que mejor se adapte a ti. Cuando hagas clic en el enlace, encontrarás toda la información que necesitas. Si tienes alguna pregunta adicional, aquí estamos para ayudarte. Esperamos que pronto hagas parte del futuro de las finanzas.",Inscripción y registro al mundo Nu (Prospectos nuevos)
[ACQ] Push - ¿Por mensajería instantánea sabré si mi tarjeta ha sido aprobada?,Gracias por confiar en nosotros. Queremos informarte que la respuesta a tu solicitud la recibirás en el correo electrónico que hayas registrado con Nu. ¡Esperamos darte pronto una buena noticia!,Inscripción y registro al mundo Nu (Prospectos nuevos)
[EMAIL] - [ACQ] - Prospecto abandoned o confirmed: Mensaje en blanco o sin contexto,"Hola, XXXX: Gracias por contactar a Nu. ¡Esperamos que estés muy bien! Hemos recibido este correo electrónico, pero está en blanco. Para poder comprender mejor tu consulta, nos podrías describir o contar en que paso del registro estás, y si tienes alguna duda relacionada o si estás presentando algún inconveniente. En caso de que nos puedas compartir evidencias visuales, como fotos, captura de pantalla o video de lo que visualizas en tu App, también nos ayudaría mucho a comprender tu consulta. Para nosotros es muy importante acompañarte de la mejor manera en esta fase de registro. Quedamos pendiente de tu respuesta. Un abrazo, Equipo Nu.",Inscripción y registro al mundo Nu (Prospectos nuevos)
[EMAIL] - [ACQ] - Prospecto abandoned o confirmed: Usuario no sabe cómo retomar su registro,"Hola, XXXX: Gracias por contactar a Nu. ¡Esperamos que estés muy bien! Validando tu caso, observamos que ya activaste tu invitación, pero el registro en la App quedó incompleto, es decir que",Inscripción y registro al mundo Nu (Prospectos nuevos)
[EMAIL] - [ACQ] - Correos resueltos Acquisition: Solved ticket por falta de interacción,"Hola, XXXXX. Gracias por contactar a Nu Colombia. Esperamos que te encuentres muy bien. Queremos comentarte que por el momento no hemos evidenciado una interacción o respuesta de tu parte sobre tu caso referente a XXXXX, por lo cual procederemos a cerrar este correo. Pero no te preocupes, si queda algo pendiente no olvides que estamos disponibles para ti las 24 horas del día en nuestros diferentes canales de comunicación que te dejamos aquí: Líneas telefónicas: 1) Bogotá: 601 357 11 02 2) Colombia: 01 800 917 2000 3) Resto del mundo: +1 636 722 7111 4) Correo electrónico: ayuda@nu.com.co 5) Chat: Ingresando en tu App en la opción 'Ayuda' Si tienes cualquier otra inquietud, no dudes en contactarnos nuevamente a través de nuestros canales oficiales de atención al cliente 24/7. Recuerda que puedes visitar nuestro blog en el siguiente enlace, para enterarte de todas nuestras novedades. Un abrazo, Equipo Nu. En Nu valoramos tu opinión y siempre buscamos mejorar nuestro servicio. En 24 horas, recibirás una encuesta en tu App donde podrás comentarnos, en una escala del 0 al 10, qué tanto recomendarías Nu, siendo: • 0 a 6: ""No nos recomendarías"" • 7 a 8: ""Quizá nos recomendarías"" • 9 a 10: ""Nos recomendarías totalmente"". ¡Te deseamos un gran día y recuerda que tenemos servicio 24/7 para apoyarte en lo que necesites!",Inscripción y registro al mundo Nu (Prospectos nuevos)
[EMAIL] - [ACQ] - Cross-sell: Cliente no le aparece el banner de Cuenta Nu (oferta expiro),"¡Hola XXXXX! ¡Gracias por contactarte con Nu! Esperamos que te encuentres muy bien. Nos alegra mucho que quieras ser parte del futuro de los servicios financieros con nuestra Cuenta Nu. Después de hacer las revisiones pertinentes de tu caso, te informamos que en las próximas 72 horas (3 días calendario), podrás empezar con el flujo de registro para tu cuenta de ahorros a través de la pantalla principal de tu aplicación Nu. Si dentro de este tiempo no ves el banner con la oferta en tu aplicación, por favor vuelve a contactarte con nosotros para que de esta manera podamos colaborarte con tu requerimiento lo más pronto posible. Recuerda que puedes visitar nuestro blog en el siguiente enlace: https://blog.nu.com.co/nu-colombia/, para enterarte de todas nuestras novedades. Un abrazo, Equipo Nu. En Nu valoramos tu opinión y siempre buscamos mejorar nuestro servicio. En 24 horas, recibirás una encuesta en tu App donde podrás comentarnos, en una escala del 0 al 10, qué tanto recomendarías Nu, siendo: 1) 0 a 6: ""No nos recomendarías"" 2) 7 a 8: ""Quizá nos recomendarías"" 3) 9 a 10: ""Nos recomendarías totalmente"". ¡Te deseamos un gran día y recuerda que tenemos servicio 24/7 para apoyarte en lo que necesites!",Inscripción y registro al mundo Nu (Prospectos nuevos)
