Nombre,Macro,Contact Reason 
"[RegSol] - Una vez que haya enviado las respuestas del formulario, ¿puedo tener certeza de que sigo siendo cliente de Nu? (Tag KYC_INFO_REQUESTED)","El proceso de vinculación depende de la calidad de la información que nos compartas, ya que esto permitirá que podamos avanzar lo más pronto posible con tu proceso. A continuación te dejo el link para que puedas acceder al formulario: https://docs.google.com/forms/d/e/1FAIpQLScNSelDj6447LwB0RoYzIXubgNWZ2ElCR88tzf_VhhcmU1CFg/viewform Estos documentos nos permitirán finalizar las validaciones internas. Ten presente que solo se tendrán en cuenta las respuestas diligenciadas dentro del formulario. Toda tu información será tratada de acuerdo a nuestra política de privacidad y de tratamiento de datos personales que puedes consultar aquí: https://contracts.nu.com.co/legal-documents/nu-CF-data-policy-version-3.pdf",Contactos relacionados con Regsol
[RegSol] - Usuario con problemas en el formulario - Preguntas Manuales (Tag KYC_INFO_REQUESTED),"Como me indicas que tienes problemas para acceder a nuestro formulario de registro, te comparto las preguntas que se encuentran allí, puedes enviar las respuestas por este mismo medio y adjuntar los documentos requeridos: Cuéntanos detalladamente de dónde provienen tus ingresos mensuales y las actividades económicas que desempeñas. En caso de tener más de una actividad económica, por favor, cuéntanos: ¿cuáles son y qué porcentaje representan de tus ingresos declarados? Especifica la actividad o actividades económicas de las que provienen tus ingresos, evitando términos ambiguos o amplios, como “comerciante”, o “independiente”. Por último, adjunta uno de los siguientes documentos como soporte de tu respuesta anterior: Certificado laboral con ingresos. Expedido hace 3 meses o menos. Declaración de renta del último año gravable 2023 que tenga la marca de agua de recibido y el sello de la DIAN. Comprobante de pensión: No mayor a 3 meses. Contrato de arrendamiento: Si tu fuente de ingresos proviene del arriendo de inmuebles. Certificado de ingresos: Con fecha de emisión no mayor a un año y expedido por un Contador público con matrícula profesional activa. Contrato de prestación de servicios. Una vez proporcionada la información, voy a realizar el escalamiento con el área encargada para que se valide tu información cuanto antes. Te recomiendo estar pendiente de tu correo electrónico en caso de que necesitemos información adicional. Toda tu información será tratada de acuerdo a nuestra política de privacidad y de tratamiento de datos personales que puedes consultar aquí: https://contracts.nu.com.co/legal-documents/nu-CF-data-policy-version-3.pdf",Contactos relacionados con Regsol
"[RegSol] - Ya envié mis respuestas, ¿qué pasa con mi proceso de vinculación? (Tag KYC_INFO_REQUESTED)","Realicé la validación de tu información y pude identificar que tus respuestas no han sido recibidas exitosamente. En días anteriores, te enviamos un correo electrónico solicitando información adicional para completar el proceso. Puedes revisar tu bandeja de entrada y proporcionar la información requerida lo antes posible. Una vez que recibamos los documentos solicitados, podremos continuar con el proceso de aprobación de tu solicitud. Te comparto el link del formulario para que puedas enviar tus respuestas cuanto antes y continuar con el proceso: https://docs.google.com/forms/d/e/1FAIpQLScNSelDj6447LwB0RoYzIXubgNWZ2ElCR88tzf_VhhcmU1CFg/viewform Recuerda que toda tu información será tratada de acuerdo a nuestra política de privacidad y de tratamiento de datos personales que https://contracts.nu.com.co/legal-documents/nu-CF-data-policy-version-3.pdf",Contactos relacionados con Regsol
[RegSol] - ¿Cuánto tiempo tardan en revisar mis respuestas? (Tag KYC_INFO_REQUESTED),"Validando la información puedo observar que tus respuestas han sido recibidas exitosamente. Quiero informarte que tu proceso de registro se encuentra en etapa de validación. Esto puede tardar hasta 5 días hábiles. Mientras completamos esta fase, te pedimos un poco más de paciencia. Queremos asegurarnos de que todo esté en perfecto orden para que puedas disfrutar plenamente de nuestros productos. Aquí te hago algunas recomendaciones para esta etapa: -Asegúrate de estar al tanto de cualquier comunicación o solicitud adicional de nuestro equipo a través de correo electrónico. - Si tienes preguntas o necesitas asistencia, no dudes en contactarnos a través de correo electrónico, teléfono, o chat. Estamos aquí para ayudarte en cada paso.",Contactos relacionados con Regsol
[RegSol] - ¿Cómo debe el tercero completar y enviar esta autocertificación de dependencia económica? (Tag KYC_INFO_REQUESTED),"Para continuar con el proceso es fundamental que el tercero la complete y firme la Autocertificación de Dependencia Económica que te enviamos en el correo anterior. Pídele que lea atentamente el PDF adjunto, llene todos los datos con precisión (personales, actividad económica, origen de fondos y la autorización al tratamiento de sus datos personales) y lo firme (digital o manualmente de forma legible). Una vez completo y firmado, por favor, adjúntalo en el formulario correspondiente. Este paso es muy importante para tu solicitud y ten la tranquilidad de que toda la información será tratada de forma segura bajo nuestra política de privacidad y tratamiento de datos personales que puedes consultar aquí: https://contracts.nu.com.co/legal-documents/nu-CF-data-policy-version-3.pdf ¡Esperamos contar con tu colaboración para que puedas disfrutar los beneficios de Nu! 💜",Contactos relacionados con Regsol
[RegSol] - ¿Es obligatorio que el tercero llene y firme esta autocertificación de dependencia económica? ¿Qué ocurre si no lo hace? (Tag KYC_INFO_REQUESTED),"Es importante que sepas que es necesario recibir este documento diligenciado, ya que sin esto no podemos completar la verificación de tus ingresos de acuerdo con nuestras políticas internas. Por lo que lamentablemente no podremos avanzar con tu solicitud ni ofrecerte nuestros servicios. Sabemos que este es un paso adicional y agradecemos mucho tu apoyo y el del tercero para completarlo. Recuerda que adjuntamos el formato en el correo que recibiste y que toda tu información será tratada de acuerdo a nuestra política de privacidad y de tratamiento de datos personales, puedes consultarla aquí: https://contracts.nu.com.co/legal-documents/nu-CF-data-policy-version-3.pdf ¡Esperamos contar con tu colaboración para que puedas empezar a disfrutar los beneficios de Nu! 💜",Contactos relacionados con Regsol
[RegSol] - ¿Por qué me están pidiendo una autocertificación de dependencia económica? (Tag KYC_INFO_REQUESTED),"Te pedimos esta autocertificación porque identificamos que tus ingresos principales provienen de un tercero. Para cumplir con nuestras políticas internas, es necesario que esta persona certifique los ingresos que te suministra. Ten toda la tranquilidad que tu información será tratada de acuerdo a nuestra política de privacidad y de tratamiento de datos personales, la cual puedes consultar aquí. Adjunto al correo que recibiste, encontrarás un documento PDF con el formato de autocertificación que el tercero deberá completar y firmar. Este paso es fundamental para poder validar tu perfil y avanzar con tu solicitud, lo puedes adjuntar como soporte en el siguiente formulario: https://docs.google.com/forms/d/e/1FAIpQLScNSelDj6447LwB0RoYzIXubgNWZ2ElCR88tzf_VhhcmU1CFg/viewform. Por favor, ayúdanos completando la información lo antes posible para continuar con las validaciones y puedas comenzar a usar tus productos Nu. 😊",Contactos relacionados con Regsol
"[RegSol] - ¿Puedo responder las preguntas que me enviaron por correo , por este medio? (Tag KYC_INFO_REQUESTED)","Te comento que para poder continuar con el proceso, es indispensable que respondas las preguntas que te enviamos a través del formulario. La calidad de la información que nos compartas va a permitir que podamos avanzar lo más pronto posible con tu proceso. Te comparto el link: https://docs.google.com/forms/d/e/1FAIpQLScNSelDj6447LwB0RoYzIXubgNWZ2ElCR88tzf_VhhcmU1CFg/viewform",Contactos relacionados con Regsol
[RegSol] - ¿Si ya tengo la tarjeta de crédito por qué tengo que hacer este proceso? (Tag KYC_INFO_REQUESTED),"Te comento que al tratarse de dos productos diferentes, debemos ajustarnos a lo que nos exige la regulación Colombiana para cada producto. Aunque ya cuentas con la tarjeta de crédito, para poder continuar con el proceso de tu Cuenta de Ahorros y cumplir los requisitos legales colombianos, es indispensable que respondas las preguntas que te enviamos. Solo tienes que abrir el formulario y diligenciar la información, solo toma unos pocos minutos, a continuación te comparto el link: https://docs.google.com/forms/d/e/1FAIpQLScNSelDj6447LwB0RoYzIXubgNWZ2ElCR88tzf_VhhcmU1CFg/viewform",Contactos relacionados con Regsol
[Regsol] - Me están solicitando documentos que certifiquen mis ingresos (tag KYC_INFO_REQUESTED o REQUESTED_PEP_INFO),"Para continuar con tu solicitud, te invito a que respondas al correo que recibiste, con el desprendible de nomina de los úiltimos 3 meses o la declaración de renta del año 2023. Quiero informarte sobre las alternativas que aceptamos en caso de que no cuentes con un desprendible de nómina o la declaración de renta del último año gravable: -Comprobante de pensión: No mayor a 3 meses. -Certificación de ingresos emitida por un Contador público: Con promedio anual o mensual, no mayor a 1 año. -Contrato de arrendamiento: Si tu fuente de ingresos proviene del arriendo de inmuebles. -Contrato de prestación de servicios. Estos documentos nos permitirán finalizar las validaciones internas. El proceso de aprobación de tu solicitud depende de la calidad de información que proporciones. Ten en cuenta que toda tu información será tratada de acuerdo a nuestra política de privacidad y tratamiento de datos personales, la cual puedes consultar aquí: https://contracts.nu.com.co/legal-documents/nu-CF-data-policy-version-3.pdf",Contactos relacionados con Regsol
[Regsol] - Prospecto con solicitud de información PENDIENTE (tags PEP_REQUESTED_INFO o KYC_INFO_REQUESTED),"Queremos informarte que tu solicitud a la [XPEER AJUSTAR ACORDE AL PROSPECTO: Cuenta de Ahorros de NU y/o Tarjeta de Crédito] se encuentra en proceso de aprobación. En días pasados te enviamos un correo electrónico solicitando información adicional para completar el proceso. Te agradeceríamos mucho si pudieras revisar tu bandeja de entrada y proporcionar la información requerida lo antes posible. Una vez que recibamos los documentos solicitados, podremos continuar con el proceso de aprobación de tu solicitud.",Contactos relacionados con Regsol
[Regsol] - Prospecto en revisión KYC (tags PEP_REQUESTED_INFO o KYC_INFO_REQUESTED),"Validando la información puedo observar que tus respuestas han sido recibidas exitosamente. Quiero informarte que tu proceso de registro se encuentra en etapa de validación. Esto puede tardar hasta 5 días hábiles. Mientras completamos esta fase, te pedimos un poco más de paciencia. Queremos asegurarnos de que todo esté en perfecto orden para que puedas disfrutar plenamente de nuestros productos. Aquí te hago algunas recomendaciones para esta etapa: -Asegúrate de estar al tanto de cualquier comunicación o solicitud adicional de nuestro equipo a través de correo electrónico. - Si tienes preguntas o necesitas asistencia, no dudes en contactarnos a través de correo electrónico, teléfono, o chat. Estamos aquí para ayudarte en cada paso.",Contactos relacionados con Regsol
"[Regsol] - Ya completé las preguntas, ¿qué sigue? [Xpeer confirma que SI se recibió respuesta] (tag KYC_INFO_REQUESTED o REQUESTED_PEP_INFO)","Validando la información puedo observar que tus respuestas han sido recibidas exitosamente. Quiero informarte que tu proceso de registro se encuentra en etapa de validación. Esto puede tardar hasta 5 días hábiles. Mientras completamos esta fase, te pedimos un poco más de paciencia. Queremos asegurarnos de que todo esté en perfecto orden para que puedas disfrutar plenamente de nuestros productos. Aquí te hago algunas recomendaciones para esta etapa: -Asegúrate de estar al tanto de cualquier comunicación o solicitud adicional de nuestro equipo a través de correo electrónico. - Si tienes preguntas o necesitas asistencia, no dudes en contactarnos a través de correo electrónico, teléfono, o chat. Estamos aquí para ayudarte en cada paso.",Contactos relacionados con Regsol
[Regsol] - ¿Si no envío la información que me solicitan qué va a pasar? (tag KYC_INFO_REQUESTED o REQUESTED_PEP_INFO),"Las preguntas que te hacemos en el formulario que recibiste hace unos días, hacen parte de lo que nos exige la regulación Colombiana, Ley 1328 de 2009 - Régimen de Protección al Consumidor Financiero. Para poder continuar con el proceso, es indispensable recibir la información y documentos solicitados. De lo contrario, tu registro será archivado y en caso de que quieras ser cliente Nu, deberás reiniciar tu registro en www.nu.com.co",Contactos relacionados con Regsol
[Regsol]- Prospecto en revisión KYC,"¡Hola! Queremos informarte que tu proceso de registro está en la etapa de validación. Esto es parte de nuestro procedimiento estándar para asegurarnos de ofrecerte el mejor servicio posible. Mientras completamos esta fase, te pedimos un poquito más de paciencia. Querem",Contactos relacionados con Regsol
"[ACQ] - Ex-cliente quiere reactivar o tener otros productos Nu: Me registré en la web con el mismo correo, pero no me llega la invitación","Gracias por reportarme lo que está sucediendo. Te comparto unas recomendaciones necesarias para realizar el proceso: 1. Asegúrate de que tu bandeja de entrada tenga espacio disponible y utilizar el mismo correo electrónico con el que te registraste previamente al enviar tu solicitud. 2. Revisa tu bandeja de spam/correos no deseados, puede que el mensaje se haya redireccionado allí. 3. Verifica tus correos en la franja de horario en la que te registraste. 4. Intenta iniciar sesión en tu App y empieza el flujo de registro directamente en el botón “Abrir Cuenta Nu”. 5. Si definitivamente no recibiste el correo, por favor ponte en contacto con nosotros y confírmanos los siguientes datos: a) ¿Hiciste uso de VPN? b) Navegador que utilizaste; c) Correo electrónico con el cual te registraste; d) El tipo de conexión a internet (Datos celular, Wifi pública, Wifi por un operador, por ejemplo: Movistar, ETB, Claro, etc.).",Reactivación de productos (Cuenta Nu)
"[ACQ] - Ex-cliente quiere reactivar o tener otros productos Nu: Me registré en la web, pero solo me llegan correos de que mi cuenta está a salvo, ¿qué hago?","Gracias por reportarme lo sucedido, validando tu caso, veo que el correo que estás recibiendo es debido a que, estás realizando el registro en el formulario con un correo electrónico diferente al que tenías registrado con Nu. Te comparto unas recomendaciones para que puedas realizar el proceso de registro nuevamente y sin inconvenientes: Si eres cliente activo o si cancelaste todos tus productos Nu, por seguridad de tus datos, debes registrarte nuevamente en nuestro formulario, con el mismo correo electrónico que tienes o tenías vinculado con nosotros. Puedes hacerlo a través de nuestra página web: https://nu.com.co/ o en la App de Nu, en la opción ”Quiero ser Nu”. No olvides verificar que todos tus datos personales estén correctos al momento de llenar el formulario. Una vez que finalices el formulario y lo envíes. Al correo registrado, te llegarán los pasos que debes seguir para continuar con tu registro en la App, mediante la opción “Soy cliente”. En caso de que tengas inconvenientes con tu correo electrónico registrado, me cuentas, para brindarte soporte.",Reactivación de productos (Cuenta Nu)
"Nos hace feliz saber que quieres ser parte de Nu nuevamente con la cuenta de ahorros. Para tener el producto y comenzar a vivir una nueva experiencia de ahorro, debes: Registrarte nuevamente en nuestro formulario de solicitud de productos, puedes hacerlo a través de nuestra página web: https://nu.com.co/ o en la App de Nu, en la opción ”Quiero ser Nu”. El registro debe ser con el mismo correo electrónico que tenías vinculado a Nu. Al correo registrado te llegarán los pasos que debes seguir para continuar con tu registro en la App, mediante la opción “Soy cliente”. ¡Y listo! Puedes comenzar el proceso para abrir Cuenta Nu, donde te pediremos la confirmación y/o registro de tus datos nuevamente. Este proceso es requerido para la seguridad de tus datos y para establecer tu relación con los productos que adquieras.","Nos hace feliz saber que quieres ser parte de Nu nuevamente con la cuenta de ahorros. Para tener el producto y comenzar a vivir una nueva experiencia de ahorro, debes: Registrarte nuevamente en nuestro formulario de solicitud de productos, puedes hacerlo a través de nuestra página web: https://nu.com.co/ o en la App de Nu, en la opción ”Quiero ser Nu”. El registro debe ser con el mismo correo electrónico que tenías vinculado a Nu. Al correo registrado te llegarán los pasos que debes seguir para continuar con tu registro en la App, mediante la opción “Soy cliente”. ¡Y listo! Puedes comenzar el proceso para abrir Cuenta Nu, donde te pediremos la confirmación y/o registro de tus datos nuevamente. Este proceso es requerido para la seguridad de tus datos y para establecer tu relación con los productos que adquieras.",Reactivación de productos (Cuenta Nu)
[ACQ] - Ex-cliente quiere reactivar o tener otros productos Nu: ¿Cómo puedo ocultar o eliminar el producto cancelado de tarjeta de crédito Nu?,"Por el momento, no es posible realizar esta acción. Sin embargo, seguimos trabajando cada día para mejorar la experiencia de nuestros clientes en la App.",Reactivación de productos (Cuenta Nu)
[ACQ] - Ex-cliente quiere reactivar o tener otros productos Nu: ¿Me llegará una nueva tarjeta débito o me reactivarán la tarjeta cancelada?,"Me alegra contarte que te enviaremos una nueva tarjeta débito, para que puedas disfrutar todos los beneficios que tenemos diseñados para ti 💜. En tu aplicación, podrás hacer el seguimiento del envío de tu nueva tarjeta en el transcurso de estos días. Si deseas hacer uso de tu tarjeta mientras llega de manera física, podrás crear tarjetas virtuales desde tu App, siguiendo estos sencillos pasos: 1. En la pantalla principal, ingresa a la parte ""Mis tarjetas""; 2. Escoge ""Crear tarjeta"" y continuar; 3. Ingresa tu PIN de 4 dígitos para activar la tarjeta; ¡Y listo! Ya tendrás creada tu tarjeta virtual. Recuerda que ésta puede ser eliminada o bloqueada las veces que necesites, sin afectar tu tarjeta física y podrás tener activas hasta 10 diferentes tarjetas virtuales por producto.",Reactivación de productos (Cuenta Nu)
[ACQ] - Ex-cliente quiere reactivar o tener otros productos Nu: ¿Por qué debo hacer nuevamente el proceso de envío de información/fotos?,"Me da gusto poder ayudarte con tu consulta. Por la seguridad de tu información y por requerimiento, necesitamos validar tus datos personales en este nuevo proceso de vinculación para el producto que deseas adquirir.",Reactivación de productos (Cuenta Nu)
[ACQ] - Ex-cliente quiere reactivar o tener otros productos Nu: ¿Por qué si yo solicite eliminación de datos me están pidiendo que ingrese con mi correo electrónico anterior?,"Es importante que ingreses con tu correo electrónico registrado con nosotros, debido a que, al cancelar la relación comercial con todos tus productos Nu, el tratamiento de datos, al momento de su solicitud de eliminación, establece un periodo para que esta eliminación se haga completamente efectiva. Es por esto, que al registrarte nuevamente con tu correo electrónico vinculado previamente, tu usuario se activará de nuevo.",Reactivación de productos (Cuenta Nu)
[ACQ] - Ex-cliente quiere reactivar o tener otros productos Nu: ¿Puedo volver a tener la cuenta de ahorros?,"Me alegra saber que quieres tener nuevamente la Cuenta Nu, a continuación te cuento cómo puedes hacerlo: Si ya eres cliente con alguno de nuestros productos o si cancelaste todos tus productos Nu, de cualquier manera y por seguridad de tus datos, debes registrarte nuevamente en nuestro formulario de solicitud de productos, puedes hacerlo a través de nuestra página web: https://nu.com.co/ o en la App de Nu, en la opción ”Quiero ser Nu”. Es necesario que este registro lo realices con el mismo correo electrónico que tienes o tenías vinculado con nosotros. Al correo registrado, te llegarán los pasos que debes seguir para continuar con tu registro en la App, mediante la opción “Soy cliente”. Finalmente, comienza el proceso de registro dando clic en el banner de la App que dice “Abrir cuenta Nu”, donde te pediremos la confirmación y registro de tus datos nuevamente. En caso de que tengas inconvenientes con tu correo registrado o para restablecer la contraseña de acceso a la App, podemos contactarte con una persona de nuestros equipos especializados y hacer este proceso lo más sencillo para ti.",Reactivación de productos (Cuenta Nu)
[EMAIL] - [ACQ] - Reactivación o adquisición de productos para Ex-Clientes: ¿A que hace referencia la pregunta de si declaro impuestos en otro país?,"Hola, XXXXX: ¡Gracias por contactar a Nu! Esperamos que te encuentres bien. Para nosotros es importante cumplir con la norma y esta nos pide solicitarte información si eres un residente fiscal, es decir, si tienes obligaciones tributarias (declarar impuestos) en uno o varios países diferentes a Colombia. Ten en cuenta que, estos datos están protegidos al ser de uso exclusivo de Nu, de acuerdo a nuestra Política de Tratamiento de Datos, la cual puedes consultar en nuestra página web https://nu.com.co/ o en el siguiente documento: https://contracts.nu.com.co/legal-documents/nu-CF-data-policy-version-2.pdf. Para enterarte de más detalles de nuestros productos, te invitamos a seguirnos en nuestras redes sociales o revisar nuestro blog https://blog.nu.com.co/. Si tienes alguna inquietud adicional, no dudes en contactarnos por cualquier canal de comunicación disponible para ti. Un abrazo, Equipo Nu. En Nu valoramos tu opinión y siempre buscamos mejorar nuestro servicio. En 24 horas, recibirás una encuesta en tu App donde podrás comentarnos, en una escala del 0 al 10, qué tanto recomendarías Nu, siendo: 1) 0 a 6: ""No nos recomendarías"" 2) 7 a 8: ""Quizá nos recomendarías"" 3) 9 a 10: ""Nos recomendarías totalmente"". ¡Te deseamos un gran día y recuerda que tenemos servicio 24/7 para apoyarte en lo que necesites!",Reactivación de productos (Cuenta Nu)
[EMAIL] - [ACQ] - Reactivación o adquisición de productos para Ex-clientes ¿Por qué al terminar el proceso en la App me dice que verificarán mis datos?,"Hola, XXXXX: Gracias por contactar a Nu. Esperamos que te encuentres bien. Para nosotros tu seguridad es lo más importante, por eso verificamos la información que todos nuestros usuarios nos comparten. En algunos casos, podemos pedirte información",Reactivación de productos (Cuenta Nu)
[ACQ] - Ex-cliente quiere reactivar o tener otros productos Nu: ¿Puedo tener la tarjeta de crédito si cancelé la Cuenta Nu?,"Gracias por tu interés en tener la tarjeta de crédito Nu. Te cuento que, por ahora, no podemos ofrecerte el producto de tarjeta de crédito Nu, pero estamos trabajando para seguir mejorando y adaptarnos a todas las necesidades de nuestros usuarios. Para enterarte de más detalles de nuestros productos, te invitamos a seguirnos en nuestras redes sociales o revisar nuestro blog https://blog.nu.com.co/.",Reactivación de productos (Tarjeta de Crédito Nu)
[ACQ] - Ex-cliente quiere reactivar o tener otros productos Nu: ¿Puedo volver a tener la tarjeta de crédito?,"Gracias por tu interés en volver a tener la tarjeta de crédito Nu. Te cuento que, por ahora, no podemos volver a ofrecerte el producto de tarjeta de crédito Nu, pero estamos trabajando para seguir mejorando y adaptarnos a todas las necesidades de nuestros usuarios. Para enterarte de más detalles de nuestros productos, te invitamos a seguirnos en nuestras redes sociales o",Reactivación de productos (Tarjeta de Crédito Nu)
